{
  "$id": "https://tropica.me/schemas/publication.schema.json",
  "$schema": "http://json-schema.org/draft-07/schema#",
  "title": "Publicaci√≥n",
  "type": "object",
  "additionalProperties": false,
  "required": [
    "id",
    "slug",
    "title",
    "summary",
    "body",
    "tags",
    "section",
    "status",
    "authorEmail",
    "createdAt",
    "updatedAt",
    "publishedAt"
  ],
  "properties": {
    "id": {
      "type": "string",
      "pattern": "^[a-z0-9-]{3,}$"
    },
    "slug": {
      "type": "string",
      "minLength": 3
    },
    "title": {
      "type": "string",
      "minLength": 3
    },
    "summary": {
      "type": "string",
      "minLength": 10
    },
    "body": {
      "type": "string",
      "minLength": 20
    },
    "tags": {
      "type": "array",
      "minItems": 1,
      "items": {
        "type": "string",
        "minLength": 2
      }
    },
    "section": {
      "type": "string",
      "minLength": 3
    },
    "status": {
      "type": "string",
      "enum": ["draft", "published"]
    },
    "authorEmail": {
      "type": "string",
      "pattern": "^[^\\s@]+@[^\\s@]+\\.[^\\s@]+$"
    },
    "createdAt": {
      "type": "string",
      "pattern": "^\\d{4}-\\d{2}-\\d{2}T\\d{2}:\\d{2}:\\d{2}\\.\\d{3}Z$"
    },
    "updatedAt": {
      "type": "string",
      "pattern": "^\\d{4}-\\d{2}-\\d{2}T\\d{2}:\\d{2}:\\d{2}\\.\\d{3}Z$"
    },
    "publishedAt": {
      "type": ["string", "null"],
      "pattern": "^(null|\\d{4}-\\d{2}-\\d{2}T\\d{2}:\\d{2}:\\d{2}\\.\\d{3}Z)$"
    }
  }
}
