{
  "id": "2024-automatizaciones",
  "slug": "publicaciones/automatizaciones-2024",
  "title": "Automatizaciones clave para el Q3",
  "summary": "Listado priorizado de automatizaciones que deben implementarse durante el tercer trimestre.",
  "body": "Este informe detalla los flujos prioritarios, dependencias y recursos requeridos...",
  "tags": ["automatizacion", "roadmap"],
  "section": "publicaciones",
  "status": "published",
  "authorEmail": "manuel@tropica.me",
  "createdAt": "2024-02-20T11:15:00.000Z",
  "updatedAt": "2024-05-28T13:45:00.000Z",
  "publishedAt": "2024-05-30T09:00:00.000Z"
}
