[
  {
    "id": "2024-automatizaciones",
    "slug": "publicaciones/automatizaciones-2024",
    "title": "Automatizaciones clave para el Q3",
    "summary": "Listado priorizado de automatizaciones que deben implementarse durante el tercer trimestre.",
    "body": "Este informe detalla los flujos prioritarios, dependencias y recursos requeridos...",
    "tags": ["automatizacion", "roadmap"],
    "section": "publicaciones",
    "status": "published",
    "authorEmail": "manuel@tropica.me",
    "createdAt": "2024-02-20T11:15:00.000Z",
    "updatedAt": "2024-05-28T13:45:00.000Z",
    "publishedAt": "2024-05-30T09:00:00.000Z"
  },
  {
    "id": "2024-campanas",
    "slug": "publicaciones/campanas-integradas-2024",
    "title": "Campañas integradas 2024",
    "summary": "Propuesta de campañas de marketing integradas para fortalecer posicionamiento de marca.",
    "body": "La propuesta se centra en tres ejes narrativos, con entregables escalonados por trimestre...",
    "tags": ["marketing", "campanas"],
    "section": "publicaciones",
    "status": "draft",
    "authorEmail": "micaela@tropica.me",
    "createdAt": "2024-03-12T09:45:00.000Z",
    "updatedAt": "2024-05-22T17:10:00.000Z",
    "publishedAt": null
  },
  {
    "id": "2024-vision",
    "slug": "publicaciones/vision-2024",
    "title": "Visión estratégica 2024",
    "summary": "Resumen ejecutivo de los objetivos estratégicos para el segundo semestre de 2024.",
    "body": "La visión 2024 consolida el enfoque en crecimiento sostenible y la expansión regional...",
    "tags": ["estrategia", "planificacion"],
    "section": "publicaciones",
    "status": "published",
    "authorEmail": "benjamin@tropica.me",
    "createdAt": "2024-01-15T09:00:00.000Z",
    "updatedAt": "2024-06-01T18:30:00.000Z",
    "publishedAt": "2024-06-02T10:00:00.000Z"
  }
]
