{
  "id": "2024-campanas",
  "slug": "publicaciones/campanas-integradas-2024",
  "title": "Campañas integradas 2024",
  "summary": "Propuesta de campañas de marketing integradas para fortalecer posicionamiento de marca.",
  "body": "La propuesta se centra en tres ejes narrativos, con entregables escalonados por trimestre...",
  "tags": ["marketing", "campanas"],
  "section": "publicaciones",
  "status": "draft",
  "authorEmail": "micaela@tropica.me",
  "createdAt": "2024-03-12T09:45:00.000Z",
  "updatedAt": "2024-05-22T17:10:00.000Z",
  "publishedAt": null
}
