{
  "id": "2024-vision",
  "slug": "publicaciones/vision-2024",
  "title": "Visión estratégica 2024",
  "summary": "Resumen ejecutivo de los objetivos estratégicos para el segundo semestre de 2024.",
  "body": "La visión 2024 consolida el enfoque en crecimiento sostenible y la expansión regional...",
  "tags": ["estrategia", "planificacion"],
  "section": "publicaciones",
  "status": "published",
  "authorEmail": "benjamin@tropica.me",
  "createdAt": "2024-01-15T09:00:00.000Z",
  "updatedAt": "2024-06-01T18:30:00.000Z",
  "publishedAt": "2024-06-02T10:00:00.000Z"
}
